version,comunidad,codigo_ente,tipo_ente,accionista_mayoritario,nombre,cif,capital_social,finalidad,regimen_contable,regimen_presupuestario,sector_admin_publica,fuente_alta,alta_desde,ente_proviene,direccion,localidad,codigo_postal,provincia,telefono,fax,sitio_web,email
2019/01 situacion a  01/01/2019,País Vasco,15-00-000-B-P-014,SOCIEDADES MERCANTILES,C. Autónoma,"Neiker-Instituto Vasco de Investigación y Desarrollo Agrario, S.A.",A48167902,"  4.157.056,00","Investigación en materia de ciencias agrarias, acuáticas, ambientales y en general de recursos naturales",Privado,Estimativo,Si - CCAA                          ,"ESCRITURA   de compra-venta 03/06/1988 (Dec.132/1988, 24/05)", 03/06/1988, ,"Parque Tecnológico de Zamudio, Parcela 812. C/Berreaga 1",Derio,48160,Bizkaia,944034300,944034310,www.neiker.eus,
2019/01 situacion a  01/01/2019,País Vasco,15-00-000-X-P-115,SOCIEDADES MERCANTILES,Mayoría Pública conjunta,"Alta Velocidad Vitoria-Gasteizko Abiadura Handia, S.A.",A01474022,"600.000,00",Coordinación de actuaciones para la remodelación de la Red Arterial Ferroviaria de Vitoria-Gasteiz,Privado,Estimativo,Si - Estado                        ,"ESCRITURA de const. de 16/12/2010 (Dec. 273/2010, de 26/10)",08/02/2011, ,Calle Olaguibel. Sede de la Subdelegación del Gobierno 1,Vitoria-Gasteiz,01071,Álava,,,http://alta-velocidad-vitoria-gasteiz.webnode.es/,vitoriagasteiz.altavelocidad@gmail.com
2019/01 situacion a  01/01/2019,País Vasco,15-00-015-H-H-000,FUNDACIONES,,Fundación Gernika Gogoratuz/Gernika Gogoratuz Iraskundea,G48813372,0,Contribuir al logro de una paz emancipadora y justa a escala mundial y en el País Vasco en particular.,Privado,Estimativo,Si - CCAA                          ,ESCRITURA   constitución de 15/12/1994 (R.F. 25/09/1995),25/09/1995, ,Plaza de los Fueros s/n,Gernika-Lumo,48300,Bizkaia,,,www.gernikagogoratuz.org,info@gernikagogoratuz.org
2019/01 situacion a  01/01/2019,País Vasco,15-00-000-X-P-041,SOCIEDADES MERCANTILES,Mayoría Pública conjunta,"Festival Internacional de Cine de Donostia - San Sebastian, S.A.",A20219283,"242.808,89",Realización anual del Festival Internacional de Cine de Donostia-San Sebastián,Privado,Estimativo,Si - CCAA                          ,"ESCRITURA   de const. de 20/12/1990 (Dec. 235/1990, de 11-09)",16/03/1991, ,Plaza Okendo 1,Donostia-San Sebastián,20004,Guipúzcoa,943481212,,www.sansebastianfestival.com,
2019/01 situacion a  01/01/2019,País Vasco,50 -00-013-H-H-000,FUNDACIONES,,F. Universitaria para la Cooperación Internacional (FUCI),,0,Apoyar y potenciar la acción de las Universidades españolas en los ámbitos de la cooperación internacional y al desarrollo.,Privado,Estimativo,Si - CCAA                          ,ESCRITURA nº 1449 de 29/05/2000 (RF nº 704 de 22/10/2003),22/10/2003, ,Calle Principe 1,Madrid,28012,Madrid,913601200,913601201,www.crue.org,sgcrue@crue.org
2019/01 situacion a  01/01/2019,País Vasco,15-00-000-X-P-102,SOCIEDADES MERCANTILES,Mayoría Pública conjunta,"Sociedad para la Promoción del Aeropuerto de Bilbao, S.L.",A95177762,"3.000,00","Prestación de toda clase de servicios de promoción, fomento, desarrollo e información del Aeropuerto de Bilbao",Privado,Estimativo,Si - CCAA                          ,"ESCRITURA   de const. de 03/10/2001 (Decreto 162/2001, 30-7)",24/10/2001, ,Calle Alameda de Recalde 50,Bilbao,48009,Bizkaia,,,www.bilbaoair.com,
2019/01 situacion a  01/01/2019,País Vasco,15-00-000-B-P-002,SOCIEDADES MERCANTILES,C. Autónoma,"Euskal Telebista - Televisión Vasca, S.A. (Sociedad Unipersonal)",A48139232,"50.956.043,43",Producción y transmisión de imágenes y sonidos a través de ondas o cables,Privado,Estimativo,Si - CCAA                          ,"ESCRITURA   de const. de 04/11/1982 (Dec. 157/1982, 19-7)",04/11/1982, ,Calle Capuchinos de Basurto 2,Bilbao,48013,Vizcaya,9465630,9465630,www.eitb.com,
2019/01 situacion a  01/01/2019,País Vasco,15-00-000-B-P-006,SOCIEDADES MERCANTILES,C. Autónoma,"Sociedad para la Transformación Competitiva - Eraldaketa Lehiakorrerako Sozietatea, S.A. (SPRI)",A01021237,"  480.042.600,00","Contribuir a la promoción empresarial mediante realización de estudios, prestación de asesoramiento de servicios. Fomentar la creación de empresas.",Privado,Estimativo,Si - CCAA                          ,"ESCRITURA   de const. de 21/09/1981 (Ley 5/1981, 10-6)", 21/09/1981, ,Calle Duque de Wellington 2,Vitoria-Gasteiz,01010,Álava,944037000,,www.spri.eus/es/,info@spri.es
2019/01 situacion a  01/01/2019,País Vasco,15-00-000-B-P-091,SOCIEDADES MERCANTILES,C. Autónoma,"Lanbarren Parke Logistikoa, S.A.",A20721767,"2.944.900,00",Promover la iniciativa e inversión de actividades económicas en Guipúzcoa,Privado,Estimativo,No -                               ,"ESCRITURA   de const. de 19/12/2000 (Dec. 126/2000, 04-07)",08/02/2001, ,Plaza Done Eztebe 1,Oiartzun,20180,Guipúzcoa,943341420,943526708,www.sprilur.es,
2019/01 situacion a  01/01/2019,País Vasco,15-00-000-B-P-112,SOCIEDADES MERCANTILES,C. Autónoma,"Urolako Industrialdea, S.A.",A20118238,"14.806.440,34",Promover la inversión industrial en la comaca de Urola,Privado,Estimativo,Si - CCAA                          ,"ESCRITURA   de const. de 26/12/1985 (Dec. 373/1985, 10/12)",26/12/1985, ,Polígono Industrialdea Edificio Oficinas - Barrio Argixao. Buzón 0 ,Zumarraga,20700,Gipuzkoa,943724766,,www.sprilur.es,zumarraga@industrialdea.spri.es
2019/01 situacion a  01/01/2019,País Vasco,15-00-001-C-C-000,CONSORCIOS,,Consorcio Haurreskolak,P0100385D,0,Gestión Integral de Escuelas Infantiles,Público,Limitativo,Si - CCAA                          ,CONVENIO de Colaboración de 24/09/2003 (BOPV 26/12/2003),24/09/2003, ,"Avenida Otaola,  Edificio Jaizkibel, 1º planta 29",Eibar,20600,Guipuzkoa,94382190,,www.haurreskolak.net,
2019/01 situacion a  01/01/2019,País Vasco,15-00-000-B-U-003,ENTES PÚBLICOS,,Osakidetza-Servicio Vasco de Salud,S5100023J,0,Provisión de servicios sanitarios a través de las organizaciones públicas de servicios sanitarios dependientes del mismo.,Privado,Estimativo,Si - CCAA                          ,"LEY 8/1997, 26-6 BO País Vasco nº 138 de 21/07/1997",01/01/1998,15-00-000-B-V-008,Calle Álava 45,Vitoria-Gasteiz,01006,Álava,,,www.osakidetza.euskadi.eus,
2019/01 situacion a  01/01/2019,País Vasco,15-00-000-X-P-009,SOCIEDADES MERCANTILES,Mayoría Pública conjunta,"Sociedad Promotora de la Zona Aduanera de Irún, S.A. (ZAISA)",A20084646,"176.625.335,06","Creación, promoción y explotación de terminal de transporte",Privado,Estimativo,Pendiente -                               ,ESCRITURA   de const. de 27/07/1983 (Acuerdo de 26/07/1983),27/07/1983, ,Plaza de Euskadi (Oficina 49) 5,Irún,20305,Guipuzkoa,943630130,943633877,www.zaisa.com,info@zaisa.com
2019/01 situacion a  01/01/2019,País Vasco,15-20-005-C-C-000,CONSORCIOS,,Consorcio Autoridad Territorial del Transporte de Gipuzkoa,Q2000559A,0,"Coadyuvar a la definición de las políticas de ordenación del transporte, a la coordinación de la política común del transporte",Público,Limitativo,Si - EELL                          ,ESCRITURA   de 14/02/2011 (Convenio Colab. BOPV 15/11/2010),14/02/2011, ,Plaza Easo Kalea 74,Donostia-San Sebastián,20006,Gipuzkoa,,,www.atgipuzkoa.eus,info@atgipuzkoa.eus
2019/01 situacion a  01/01/2019,País Vasco,15-00-000-X-P-100,SOCIEDADES MERCANTILES,Mayoría Pública conjunta,"Centro Internacional de Cultura Contemporánea, S.A.",A20762233,"12.149.313,00",Creación de Proyecto Cultural y Arquitectónico para el C. Inter. de Cultura Contemp. en San Sebastián,Privado,Estimativo,Si - EELL                          ,"ESCRITURA   de cons. de 28/12/2001 (Dec. 360/2001, de 18-12)",19/01/2002, ,Plaza de las Cigarreras 1,Donostia-San Sebastián,20012,Guipúzcoa,943011311,,www.tabakalera.eu,tabakalera@tabakalera.eu
2019/01 situacion a  01/01/2019,País Vasco,15-00-010-H-H-000,FUNDACIONES,,Fundación Cursos de Verano de la UPV/EHU,G20448056,0,Organización de actividades docentes y de extensión universitaria de carácter fundamentalmente estival,Privado,Estimativo,Si - CCAA                          ,ESCRITURA   nº 498 de 22/2/1993 (R.F. 18/03/1994),18/03/1994, ,Calle Palacio Miramar s/n,San Sebastián,20008,Gipuzkoa,,,www.sc.ehu.es,
2019/01 situacion a  01/01/2019,País Vasco,15-00-000-B-P-063,SOCIEDADES MERCANTILES,C. Autónoma,"Arabako Industrialdea, S.A.",A01113505,"12.855.624,39",Estimular y promover la iniciativa y la inversión industrial en el territorio histórico de Álava.,Privado,Estimativo,Si - CCAA                          ,"ESCRITURA   de const. de 05/06/1991 (Dec. 270/1990, 9-10)",13/09/1991, ,"Calle Uzbina (Políg.Ind.de Júndiz)-Edif.Oficinas, Of.13 24",Vitoria-Gasteiz,01015,Álava,945291215,,www.sprilur.es,araba@industrialdea.spri.es
2019/01 situacion a  01/01/2019,País Vasco,15-00-000-B-V-002,OO.AA.ADMINISTRATIVOS,,IVAP-Instituto Vasco de la Administración Pública,Q2040001F,0,Normalización del uso del euskera en las organizacione publicas atendiendo a las peculiaridades de la Autonomía Vasca en la Administración.,Público,Limitativo,Si - CCAA                          ,"LEY 16/1983, 27-7 BO País Vasco nº 117 de 06/08/1983",07/08/1983, ,Calle Donostia-San Sebastián 1,Vitoria-Gasteiz,01010,Álava,945017600,945017602,www.ivap.euskadi.eus,
2019/01 situacion a  01/01/2019,País Vasco,15-00-000-X-P-122,SOCIEDADES MERCANTILES,Mayoría Pública conjunta,"Ekarpen Private Equity, S.A.",A95541090,"30.294.000,00",Promoción de empresas mediante la participación temporal de su capita,Privado,Estimativo,No -                               ,"ESCRITURA   de const. de 28/07/2008 (Dec.121/2008, 24-06)",02/10/2008, ,Calle Rodríguez Arias 23,Bilbao,48011,Vizcaya,946077826,946002623,www.ekarpen.es,ekarpen@ekarpen.es
2019/01 situacion a  01/01/2019,País Vasco,15-00-000-X-P-013,SOCIEDADES MERCANTILES,Mayoría Pública conjunta,"Vía, Promoción del Aeropuerto de Vitoria, S.A.",A01159045,"672.000,00",Promoción y desarrollo del aeropuerto internacional de Vitoria-Gasteiz,Privado,Estimativo,Pendiente -                               ,"ESCRITURA   de const. de 23/06/1994 (Dec. 158/1994, de 12-04)",07/11/1994, ,Calle Eduardo Dato 38,Vitoria-Gasteiz,01005,Álava,945141800,945143156,www.via.com,info@via.com.es
2019/01 situacion a  01/01/2019,País Vasco,15-00-000-B-P-044,SOCIEDADES MERCANTILES,C. Autónoma,"Arratiako Industrialdea, S.A.",A48211528,"  3.440.800,00",Estimular y promover la iniciativa y la inversión de actividades económicas en la comarca de Arratia (Bizkaia),Privado,Estimativo,No -                               ,"ESCRITURA   de const. de 22/10/1986 (Dec. 167/1986, 15-07)", 22/10/1986, ,"Calle Bildosola Industrialdea, edificio E1 ",Artea,48142,Bizkaia,946319051,,www.sprilur.es,arratia@industrialdea.spri.es
2019/01 situacion a  01/01/2019,País Vasco,15-00-000-B-P-102,SOCIEDADES MERCANTILES,C. Autónoma,"Zumaiako Kirol Portua, S.A.",A20506127,"60.101,00","Planificación, promoción, desarrollo y explotación de puertos deportivos",Privado,Estimativo,Si - CCAA                          ,"ESCRITURA   de compra-venta de acciones (Dec.196/2003, 29/07)", 25/08/2003,15-00-000-X-P-015,Plaza Foruen Enparantza Plaza 1,Zumaia,20750,Guipúzcoa,,,,
2019/01 situacion a  01/01/2019,País Vasco,15-00-000-X-P-107,SOCIEDADES MERCANTILES,Mayoría Pública conjunta,"Sociedad de Capital Desarrollo de Euskadi SOCADE,S.A.",A01133305,"30.050.605,22","Promoción o fomento, mediante la dotación de recursos financieros, de todo tipo de sociedades o empresas.",Privado,Estimativo,Si - CCAA                          ,"ESCRITURA   de const. de 17/02/1993 (Decreto 364/199, 30-12)",16/03/1993, ,Calle Alameda Urquijo (Edificio plaza Bizkaia) 36,Bilbao,48011,Bizkaia,944790192,,www.gestioncapitalriesgo.com,capitalriesgo@spri.es
2019/01 situacion a  01/01/2019,País Vasco,15-00-006-H-H-000,FUNDACIONES,,Fundación Privada para el Centro Superior de Música del País Vasco - Musikene,G20738423,0,"Gestión, promoción y soporte, sin afán de lucro, de iniciativas y actividades relacionadas con la enseñanza de musica de grado superior en el PV.",Privado,Estimativo,Si - CCAA                          ,ESCRITURA   nº 99 de 07/06/2001 (R.F. 11/07/2001),11/07/2001, ,Calle Europa Plaza 2,Donostia-San Sebastión,20018,Guipuzkoa,943023750,943316916,www.musikene.eus,info@musikene.eus
2019/01 situacion a  01/01/2019,País Vasco,15-00-000-B-P-028,SOCIEDADES MERCANTILES,C. Autónoma,"Osatek, S.A.",A01126309,"3.123.000,00",Prestación y provisión de servicios de apoyo al sistema sanitario y social vasco,Privado,Estimativo,Si - CCAA                          ,"ESCRITURA   de const. de 24/07/1992 (Dec.159/1992, 09-06)", 24/07/1992, ,"Calle Alameda Urquijo. Edificio Plaza Bizkaia 36, 5º",Bilbao,48011,Bizkaia,944007112,,www.osakidetza.euskadi.eus,coordinacion@osakidetza.eus
2019/01 situacion a  01/01/2019,País Vasco,15-00-000-B-V-010,OO.AA.ADMINISTRATIVOS,,Lanbide-Servicio Vasco de Empleo,Q0100571I,0,"Contribuir al pleno desarrollo del derecho al empleo, estable y de calidad, favorecer la configuración de un mercado de trabajo.",Público,Limitativo,Si - CCAA                          ,"LEY 3/2011, 13-10 BO País Vasco nº 207 de 02/11/2011",03/11/2011, ,"Calle José Atxotegi, Lanbide Vitoria-Gasteiz Txagorritxu 1",Vitoria-Gasteiz,01009,Álava,945160600,,www.lanbide.euskadi.eus,
2019/01 situacion a  01/01/2019,País Vasco,15-48-010-H-H-000,FUNDACIONES,,Fundación Museo de la Paz de Gernika / Gernikako Bakearen Museoa Fundazioa,G95222949,0,"Dirección, mantenimiento, conservación y promoción del Museo de la Paz de Gernika.",Privado,Estimativo,Si - CCAA                          ,ESCRITURA   nº 1.936 de 30/09/2002 (R.F. 03/05/2004),03/05/2004, ,Plaza de los Fueros 1,Gernika-Lumo,48300,Bizkaia,946270213,946258608,www.museodelapaz.org,museoa@gernika-lumo.net
2019/01 situacion a  01/01/2019,País Vasco,15-20-013-H-H-000,FUNDACIONES,,Fundación Ekain Fundazioa,G20854428,0,"Estudio, difusión y conocimiento del Patrimonio Histórico y maantenimiento y promoción de la réplica de Ekain y del museo de prehistoria de Zestoa.",Privado,Estimativo,Si - EELL                          ,ESCRITURA   nº 3.870 de 22/11/2004 (R.F. 05/09/2005),05/09/2005, ,Plaza Foru (Edificio Consistorial) s/n,Zestoa,20740,Gipuzkoa,943868811,,www.ekainberri.com,info@ekainberri.com
2019/01 situacion a  01/01/2019,País Vasco,15-00-000-B-P-111,SOCIEDADES MERCANTILES,C. Autónoma,"Alokabide, S.A.",A01300706,"12.020.242,08",Promoción y rehabilitación de viviendas para arrendamiento,Privado,Estimativo,Si - CCAA                          ,"ESCRITURA   Esc. de declaración de unip. (Dec.65/2011, 29/03)",17/06/2011,15-00-000-F-P-108,- Portal de Gamarra 1A-2º,Vitoria-Gasteiz,01013,Álava,945214050,945068440,www.alokabide.euskadi.eus,alokabide@alokabide.eus
2019/01 situacion a  01/01/2019,País Vasco,15-00-000-X-P-109,SOCIEDADES MERCANTILES,Mayoría Pública conjunta,"San Mamés Barria, S.L.",B95464798,"178.060.103,00","Promoción, construcción y explotación del estadio de San Mamés",Privado,Estimativo,Pendiente -                               ,"ESCRITURA   de ampl. de capital social (Dec. 145/2010, 25-05)",18/10/2010, ,Calle Gran Vía de Don Diego López de Haro 23,Bilbao,48001,Vizcaya,,,,
2019/01 situacion a  01/01/2019,País Vasco,15-00-000-B-U-012,ENTES PÚBLICOS,,Consejo de Relaciones Laborales,Q9855002C,0,"Ser un órgano de encuentro entre organizaciones, confederaciones sindicales, empresariales, Gobierno y Parlamento Vasco en materia laboral",Público,Limitativo,Si - CCAA                          ,"LEY 4/2012, de 23/02 (BOPV 05/03/2012)",06/03/2012, ,Calle Alameda Urkixo 2-3,Bilbao,48008,Vizcaya,944792100,944792101,www.crl-lhk.eus,crl-lhk@crlv.net
2019/01 situacion a  01/01/2019,País Vasco,15-00-000-B-V-013,OO.AA.ADMINISTRATIVOS,,"Gogora-Instituto de la Memoria, la Convivencia y los Derechos Humanos",Q4800763G,0,"Participación en el diseño, promoción, desarrollo y ejecución de la política pública relativa a los valores éticos y los principios democráticos",Público,Limitativo,Si - CCAA                          ,"LEY 4/2014, 27-11 BO País Vasco nº230 de 02/12/2014",22/12/2014, ,Calle María Díaz de Haro 3,Bilbao,48013,Vizcaya,944032846,,www.gogora.euskadi.eus,gogora.idazkaritza@euskadi.eus
2019/01 situacion a  01/01/2019,País Vasco,15-00-000-F-P-105,SOCIEDADES MERCANTILES,Minoría Publica conjunta,"Hazilur Enpresen Sustapena, S.A.",A01451400,"2.440.000,00",,Privado,Estimativo,No -                               ,ESCRITURA   de const. de 24/11/2008 (R.M. 20/03/2009),20/03/2009, ,Calle Granja Modelo s7N,Arkaute,01192,Álava,,,www.hazilur.com,hazilur@hazi.eus
2019/01 situacion a  01/01/2019,País Vasco,15-00-009-N-N-000,OTRAS INSTITUCIONES SIN ÁNIMO DE LUCRO,,Asociación BCAM-Basque Center For Applied Mathematics,G95543526,0,Conbstituir y consolidad un centro de investigación básica y de excelencia en Matemáticas.,Privado,Estimativo,Si - CCAA                          ,ESCRITURA   constitución de 28/08/2008 (Reg.Asoc. 15/01/2009),15/01/2009, ,Calle Alameda de Mazarredo 14,Bilbao,48009,Bizkaia,946567842,946567843,www.bcamath.org,info@bcamath.org
2019/01 situacion a  01/01/2019,País Vasco,15-00-000-B-V-005,OO.AA.ADMINISTRATIVOS,,Emakunde-Instituto Vasco de la Mujer,Q5150004I,0,"La igualdad real y efectiva de mujeres y hombres en todos los ámbitos de la vida política, económica, cultural y social del País Vasco.",Público,Limitativo,Si - CCAA                          ,"LEY 2/1988, 5-2 BO País Vasco nº 45 de 04/03/1988",04/03/1988, ,Calle Manuel Iradier 36,Vitoria-Gasteiz,01005,Álava,945016700,945016701,www.emakunde.euskadi.eus,emakunde@euskadi.eus
2019/01 situacion a  01/01/2019,País Vasco,15-00-005-N-N-000,OTRAS INSTITUCIONES SIN ÁNIMO DE LUCRO,,"Geogarapen, Asociación para la Gestión del Geoparque de la Costa Vasca",G75018705,0,Desarrollo sostenible y equilibrado del territorio del Geoparque de la Costa Vasca.,Privado,Estimativo,Si - CCAA                          ,  ACUERDO   Consejo de Gobierno de 14/12/2010, 14/12/2010, ,Calle Ifar Kalea 4,Deba,20820,Gipuzkoa,943192452,,www.geoparkea.com,
2019/01 situacion a  01/01/2019,País Vasco,15-00-000-X-P-113,SOCIEDADES MERCANTILES,Mayoría Pública conjunta,"Burtzeña Enpresa Parkea, S.A.",A95137840,"17.289.568,00",Estimar y promover la iniciativa y la inversión de actividades económicas en Burtzeña.,Privado,Estimativo,Si - CCAA                          ,ESCRITURA   de constitución de 29/12/2000 (RM 06/03/2001),06/03/2001, ,Calle Herriko Plaza 1,Barakaldo,48901,Bizkaia,944180273,,www.burtzenaparkea.com,info@burtzenaparkea.com
2019/01 situacion a  01/01/2019,País Vasco,15-00-000-F-P-107,SOCIEDADES MERCANTILES,Minoría Publica conjunta,"Vacunek, S.L.",B95423893,"76.237,00","Desarrollo de actividades de investigación en los ámbitos de las biociencias, la biotecnología, la sanidad animal y la inmunología",Privado,Estimativo,Pendiente -                               ,ESCRITURA   de const. de 10/05/2006 (R.M. 30/05/2006),30/05/2006, ,Calle Berreaga 1,Derio,48160,Bizkaia,946573565,,www.vacunek.com,marketing@vacunek.com
2019/01 situacion a  01/01/2019,País Vasco,50 -00-002-N-N-000,OTRAS INSTITUCIONES SIN ÁNIMO DE LUCRO,,Conferencia de Rectores de las Universidades Españolas (CRUE),G81093072,0,"Promoción y desarrollo de la educación superior y la investigación universitaria, así como fomento y refuerzo de la cooperación y proyección univers.",Privado,Estimativo,Si - CCAA                          ,ACTA Fundacional de 14-12-1994 (Reg. Asoc. 20/06/1995),20/06/1995, ,Plaza De las Cortes 2,Madrid,28014,Madrid,913601200,913601201,www.crue.org,info@crue.org
2019/01 situacion a  01/01/2019,País Vasco,15-00-000-B-B-000,A. G. COMUNIDAD AUTÓNOMA,,Comunidad Autónoma del País Vasco,S4833001C,0,Autogobierno de la Comunidad Auónoma de Euskadi.,Público,Limitativo,Si - CCAA                          ,"LEY ORGANICA 3/1979, 18-12 (BOE de 22 de Diciembre de 1979)",11/01/1980, ,Calle Donostita-San Sebastián 1,Vitoria,01010,Gasteiz (Alava),945017900,945017832,www.euskadi.eus,comunicacion@ej-gv.es
2019/01 situacion a  01/01/2019,País Vasco,15-00-019-H-H-000,FUNDACIONES,,Basque Center for Macromolecular Design and Engineering-Polymat Fundazioa,G75067454,0,Constituir un centro de investigación orientada y estratégica de excelencia a nivel internacional,Privado,Estimativo,Si - CCAA                          ,ESCRITURA   nº 1.101 de 25/04/2012 (R.F. 29/06/2012),29/06/2012, ,Calle IBAETA CAMPUS UPV/EHU. Avenida de Tolosa 72,Donostia - San Sebastián â?? Gipuzkoa,20018,Bizkaia,943506061,,www.bcmaterials.net,
2019/01 situacion a  01/01/2019,País Vasco,15-00-000-B-P-115,SOCIEDADES MERCANTILES,C. Autónoma,Sociedad Pública USA Basque Trade and Investment,  ,"7.000,00",Realizar cualquier acto o actividad legal para la que se pueda crear una empresa según la Ley Mercantil,Privado,Estimativo,Pendiente -                               ,"ESCRITURA   de constitución (Dec.196/2017, 18-07)", 31/12/2017, ,-  ,,,,,,,
2019/01 situacion a  01/01/2019,País Vasco,15-48-012-H-H-000,FUNDACIONES,,Fundación Azti-Azti Fundazioa,G48939508,0,"La promoción de la investigación y el estudio de las ciencias agroalimentarias, oceanográficas, pesqueras, de medio ambiente.",Privado,Estimativo,No -                               ,ESCRITURA   de constitución de 28/11/1997 (R.F. 22/12/1997),22/12/1997, ,Calle Isla de Txatxarramendi S/N,Sukarrieta,48395,Bizkaia,946574000,946572555,www.azti.es,info@azti.es
2019/01 situacion a  01/01/2019,País Vasco,15-00-000-B-U-009,ENTES PÚBLICOS,,Instituto Vasco Etxepare Euskal Institutua/Basque Institute,V20999827,0,"Promoción, difusión y proyección, fuera de la Comunidad Autónoma vasca, del euskera y de la cultura vasca.",Privado,Estimativo,Si - CCAA                          ,"LEY 3/2007, 20-4 BO País Vasco nº 89 de 10/05/2007",11/05/2007, ,Calle Prim 7,Donostia-San Sebastian,20006,Gipuzkoa,,,www.etxepare.eus,
2019/01 situacion a  01/01/2019,País Vasco,15-00-000-B-V-012,OO.AA.ADMINISTRATIVOS,,Kontsumobilde-Instituto Vasco de Consumo,Q0100569C,0,"Se encarga de definir, planificar, impulsar y ejecutar las políticas del Gobierno Vasco en materia de defensa y protección de consumidores y usuarios.",Público,Limitativo,Si - CCAA                          ,"LEY 9/2007, 29-6 BO País Vasco nº 140 de 20/07/2007",21/07/2007, ,Avenida Santiago 11,Vitoria-Gasteiz,01002,Álava,945062140,,www.kontsumobide.euskadi.eus,kontsumobide@kontsumobide.eus
2019/01 situacion a  01/01/2019,País Vasco,15-20-003-C-C-000,CONSORCIOS,,Consorcio Palacio Miramar,G20148961,0,Utilizar las distintas salas y dependencia del edifico para impartir los Cursos de Verano de la Universidad del País Vasco.,Público,Limitativo,Si - EELL                          ,  ACUERDO   de 29 de octubre de 1985,29/10/1985, ,Paseo de Miraconcha 48,Donostia-San Sebastián,20007,Guipúzcoa,943219022,,www.sc.ehu.es,info@palaciomiramar.eus
2019/01 situacion a  01/01/2019,País Vasco,15-00-012-N-N-000,OTRAS INSTITUCIONES SIN ÁNIMO DE LUCRO,,Asociación Instituto de Investigación Sanitaria Biocruces,G95756334,0,"Promover la investigación biomédica, epidemiológica, de salud pública y en servicios sanitarios",Privado,Estimativo,Si - CCAA                          ,ESCRITURA   constitución de 20/02/2014 (Reg.Asoc. 14/05/2014),14/05/2014, ,Plaza de Cruces 12,Barakaldo,48903,Vizcaya,946006073,,www.biocruces.com,
2019/01 situacion a  01/01/2019,País Vasco,15-00-000-B-P-105,SOCIEDADES MERCANTILES,C. Autónoma,"Hidroeléctrica Harana-Kontrasta, S.A.",A01405000,"1.515.159,00","Explotación de la Central Hidroeléctrica de Contrasta, para la producción y venta de energía.",Privado,Estimativo,No -                               ,"ESCRITURA   de const.nº 387 de 12/06/2006 (Dec.49/2006, 28-02)",23/10/2006, ,Avenida Antzia (Casa Consistorial) 52,Valle de Arana,01117,Álava,,,www.eve.es,
2019/01 situacion a  01/01/2019,País Vasco,15-00-000-B-V-004,OO.AA.ADMINISTRATIVOS,,Eustat-Instituto Vasco de Estadística,Q5150002C,0,"desarrolla, produce y difunde información estadística oficial de calidad, destinada a la admones. públicas vascas, agentes sociales y a la sociedad.",Público,Limitativo,Si - CCAA                          ,"LEY 4/1986, 23-4 BO País Vasco nº 105 de 30/05/1986",30/05/1986, ,Calle Donostia-San Sebastián 1,Vitoria-Gasteiz,01010,Álava,945017500,945017501,www.eustat.eus,webmaster_eustat@eustat.eus
2019/01 situacion a  01/01/2019,País Vasco,15-00-000-B-P-003,SOCIEDADES MERCANTILES,C. Autónoma,"Eusko Irratia-Radiodifusión Vasca, S.A. (Sociedad Unipersonal)",A48139224,"550.828,08",Producción y difusión de sonidos mediante emisiones radioeléctricas a través de ondas y cables,Privado,Estimativo,Si - CCAA                          ,"ESCRITURA   de const. de 04/11/1982 (Dec.158/1982, 19-07)",04/11/1982, ,Calle Capuchinos de Basurto 2,Bilbao,48013,Bizkaia,946563000,,www.eitb.com,
2019/01 situacion a  01/01/2019,País Vasco,15-00-000-B-V-009,OO.AA.ADMINISTRATIVOS,,Academia Vasca de Policía y Emergencias (AVPE),Q5150008J,0,Crear las condiciones y medios para lograr el desarrollo de su actividad.,Público,Limitativo,Si - CCAA                          ,"LEY 15/2012, 28-6 BO País Vasco nº 132 de 06/07/2012",07/07/2012,15-00-000-B-V-006,Carretera N-104 km. 356 ,Arkaute,01192,Álava,,,www.arkauteakademia.net,
2019/01 situacion a  01/01/2019,País Vasco,15-00-000-B-U-008,ENTES PÚBLICOS,,Unibasq-Agencia de Calidad del Sistema Universitario Vasco,S0100002E,0,"Evaluación, acreditación y certificación de la calidad en el ámbito del sistema univer. vasco, considerando el marco español, europeo e internacional.",Privado,Limitativo,Si - CCAA                          ,"LEY 3/2004, 25-2 BO País Vasco nº 50 de 12/03/2004",02/04/2004, ,Calle San Prudencio 8,Vitoria-Gasteiz,01005,Álava,945123356,,www.unibasq.org,
